{
  "$schema": "./site-content.schema.json",
  "version": 1,
  "isDemo": false,
  "brand": {
    "name": "Aula Rayen"
  },
  "professional": {
    "name": "Pamela Rayen Calderón",
    "shortName": "Pamela",
    "title": "Psicóloga y tallerista",
    "biography": [
      "Psicóloga y Magíster en Salud y Arteterapia, con experiencia en atención clínica infantojuvenil y familiar.",
      "Su trabajo integra psicoterapia, psicoeducación y recursos creativos desde un enfoque inclusivo, respetuoso y atento a cada etapa del desarrollo."
    ],
    "credentials": [
      "Psicóloga, Universidad de Tarapacá",
      "Magíster en Salud y Arteterapia",
      "Experiencia clínica infantojuvenil y familiar",
      "Formación en psicoterapia grupal psicodramática"
    ]
  },
  "social": {
    "instagramUrl": "https://www.instagram.com/psicologa_rayen/",
    "instagramHandle": "@psicologa_rayen"
  },
  "assets": {
    "profileImageUrl": "https://pixel-p1.s3.sa-east-1.amazonaws.com/doctor/avatar/7b3083e4/7b3083e4-e03c-4559-8d7f-e36d6a781454_large.jpg",
    "profileImageAlt": "Retrato profesional de la psicóloga Pamela Rayen Calderón"
  }
}
